Ticker 20/04/2026 02:05,name,rsi,priceToBook,enterpriseToRevenue,enterpriseToEbitda,targetHighPrice,targetLowPrice,targetMeanPrice,targetMedianPrice,recommendationMean,recommendationKey,totalCashPerShare,quickRatio,currentRatio,debtToEquity,returnOnAssets,returnOnEquity,earningsGrowth,revenueGrowth,grossMargins,operatingMargins,averageAnalystRating,trailingPegRatio
IIIN,"Insteel Industries, Inc. Common Stock",26.837101281546914,1.4172207,0.721,6.772,37.0,37.0,37.0,37.0,3.0,hold,0.776,1.386,3.712,0.834,0.07812,0.120459996,-0.485,0.075,0.13615,0.03928,3.0 - Hold,0.7188
RCI,"Rogers Communication, Inc. Common Stock",29.580813909796994,1.40687,3.128,7.247,51.388958,37.313923,41.811707,39.271973,2.23529,buy,2.671,0.5,0.606,184.53,0.038900003,0.39817002,0.302,0.126,0.45228,0.23785,2.2 - Buy,0.8618
PDS,Precision Drilling Corporation Common Stock,27.886812592219872,0.94088614,0.947,3.665,121.45866,87.60722,104.51493,104.47892,1.8,buy,6.626,1.2,1.623,46.84,0.03777,0.00189,,0.022,0.32763,0.07913,1.8 - Buy,
BTU,Peabody Energy Corporation Common Stock ,29.756109797475457,0.8819888,0.791,7.48,42.0,33.5,39.08333,40.0,1.33333,strong_buy,4.725,1.057,1.851,12.838,0.00263,-0.0116,-0.626,-0.09,0.13637,0.020539999,1.3 - Strong Buy,
BMI,"Badger Meter, Inc. Common Stock",23.538457961812266,4.760021,3.535,15.76,197.0,110.0,162.5,164.0,2.15385,buy,7.033,1.864,3.0,,0.113129996,0.19604,-0.285,-0.09,0.41368,0.17401,2.2 - Buy,2.4366
PIPR,Piper Sandler Companies Common Stock,25.678323369659783,4.4595394,2.884,,99.0,87.5,94.875,96.5,2.0,buy,18.399,1.856,1.89,7.465,0.12126,0.19607,0.651,0.376,0.90628,0.29822,2.0 - Buy,
EMO,ClearBridge Energy Midstream Opportunity Fund Inc. Common Stock,26.404512487071635,,,,,,,,,none,,,,,,,,,0.0,0.0,,
